{
  "task": "FOUND-001",
  "attempt": 2,
  "decision": "approved",
  "criteria": [
    {
      "id": "AC-01",
      "status": "passed",
      "reason": "pnpm-workspace.yaml existe no estado real do repositório, e a evidência da tentativa 2 registra pnpm install concluído com código de saída 0 usando essa configuração."
    },
    {
      "id": "AC-02",
      "status": "passed",
      "reason": "A revisão direta de pnpm-workspace.yaml confirmou a declaração explícita dos padrões apps/* e packages/*."
    },
    {
      "id": "AC-03",
      "status": "passed",
      "reason": "turbo.json existe, possui JSON válido e a evidência registra que o Turbo local 2.10.13 carregou a configuração durante o dry run."
    },
    {
      "id": "AC-04",
      "status": "passed",
      "reason": "O package.json raiz declara turbo em devDependencies com a faixa ^2.5.6."
    },
    {
      "id": "AC-05",
      "status": "passed",
      "reason": "O package.json raiz contém os scripts dev, build, lint, typecheck e test, todos delegados ao Turbo."
    },
    {
      "id": "AC-06",
      "status": "passed",
      "reason": "A evidência da tentativa 2 registra pnpm install bem-sucedido com pnpm 10.15.1. A ausência deliberada de pnpm-lock.yaml não viola o critério nem as áreas permitidas da task."
    },
    {
      "id": "AC-07",
      "status": "passed",
      "reason": "A evidência registra que o CLI local do Turbo 2.10.13 produziu com sucesso o dry run JSON do pipeline build; a configuração revisada é compatível com o formato atual de tasks."
    }
  ],
  "issues": [],
  "summary": "Todos os critérios bloqueantes foram atendidos. O issue da tentativa 1 foi resolvido: node_modules/ não existe no estado entregue nem aparece entre os arquivos não rastreados ou ignorados consultados. O estado atual contém somente os três arquivos de implementação permitidos e os artefatos esperados de evidência e review do fluxo; não foram encontradas outras alterações fora do escopo."
}
